{
  "attempted": 3,
  "models": {
    "bert-tiny": {
      "artifact_id": "bert-tiny/text-encoder/tiny/forward/fp16/dynamo/static",
      "category": "text-encoder",
      "config_sha256": "fac01bb38e52199e3bf11775d8a5dc67b538842acdab5e2c76b1b4dad5e4c115",
      "dtype": "fp16",
      "flops": {
        "status": "not_measured"
      },
      "fresh_load": {
        "cases": 2,
        "status": "ok",
        "transformers_imported": false
      },
      "graph_sha256": "5d885e4a8b83b8216e2c6c0e34b6d91aa97d4952579157129fb101f36f710438",
      "name": "bert-tiny",
      "ops": {
        "aten": [
          [
            "aten.__and__.Tensor",
            {
              "out_dtype": "bool",
              "out_rank": 4
            },
            2
          ],
          [
            "aten.add.Tensor",
            {
              "alpha": 1,
              "out_dtype": "f16",
              "out_rank": 3
            },
            6
          ],
          [
            "aten.add.Tensor",
            {
              "alpha": 1,
              "out_dtype": "f16",
              "out_rank": 4
            },
            2
          ],
          [
            "aten.add.Tensor",
            {
              "alpha": 1,
              "out_dtype": "i64",
              "out_rank": 1
            },
            2
          ],
          [
            "aten.arange.default",
            {
              "dtype": null,
              "end": 1,
              "out_dtype": "i64",
              "out_rank": 1
            },
            2
          ],
          [
            "aten.arange.default",
            {
              "dtype": null,
              "end": 16,
              "out_dtype": "i64",
              "out_rank": 1
            },
            2
          ],
          [
            "aten.contiguous.default",
            {
              "memory_format": 0,
              "out_dtype": "f16",
              "out_rank": 4
            },
            2
          ],
          [
            "aten.detach_.default",
            {
              "out_dtype": "f16",
              "out_rank": 0
            },
            1
          ],
          [
            "aten.dropout.default",
            {
              "out_dtype": "f16",
              "out_rank": 3,
              "p": 0.1,
              "train": false
            },
            5
          ],
          [
            "aten.dropout.default",
            {
              "out_dtype": "f16",
              "out_rank": 4,
              "p": 0.0,
              "train": false
            },
            2
          ],
          [
            "aten.embedding.default",
            {
              "out_dtype": "f16",
              "out_rank": 3,
              "padding_idx": "*",
              "scale_grad_by_freq": false,
              "sparse": false
            },
            3
          ],
          [
            "aten.expand.default",
            {
              "implicit": false,
              "out_dtype": "bool",
              "out_rank": 4,
              "size": "[*4]"
            },
            1
          ],
          [
            "aten.ge.Scalar",
            {
              "other": 0,
              "out_dtype": "bool",
              "out_rank": 4
            },
            1
          ],
          [
            "aten.gelu.default",
            {
              "approximate": "none",
              "out_dtype": "f16",
              "out_rank": 3
            },
            2
          ],
          [
            "aten.index.Tensor",
            {
              "out_dtype": "bool",
              "out_rank": 4
            },
            1
          ],
          [
            "aten.layer_norm.default",
            {
              "cudnn_enable": false,
              "eps": 1e-12,
              "normalized_shape": "[*1]",
              "out_dtype": "f16",
              "out_rank": 3
            },
            5
          ],
          [
            "aten.lift_fresh_copy.default",
            {
              "out_dtype": "f16",
              "out_rank": 0
            },
            1
          ],
          [
            "aten.linear.default",
            {
              "out_dtype": "f16",
              "out_rank": 2
            },
            1
          ],
          [
            "aten.linear.default",
            {
              "out_dtype": "f16",
              "out_rank": 3
            },
            12
          ],
          [
            "aten.matmul.default",
            {
              "out_dtype": "f16",
              "out_rank": 4
            },
            4
          ],
          [
            "aten.mul.Tensor",
            {
              "out_dtype": "f16",
              "out_rank": 4
            },
            2
          ],
          [
            "aten.new_ones.default",
            {
              "dtype": "torch.bool",
              "out_dtype": "bool",
              "out_rank": 0,
              "size": "[*0]"
            },
            1
          ],
          [
            "aten.reshape.default",
            {
              "out_dtype": "f16",
              "out_rank": 3,
              "shape": "[*3]"
            },
            2
          ],
          [
            "aten.select.int",
            {
              "dim": 1,
              "index": "*",
              "out_dtype": "f16",
              "out_rank": 2
            },
            1
          ],
          [
            "aten.slice.Tensor",
            {
              "dim": 1,
              "end": "*",
              "out_dtype": "i64",
              "out_rank": 2,
              "start": "*",
              "step": "*"
            },
            1
          ],
          [
            "aten.softmax.int",
            {
              "dim": -1,
              "dtype": null,
              "out_dtype": "f16",
              "out_rank": 4
            },
            2
          ],
          [
            "aten.tanh.default",
            {
              "out_dtype": "f16",
              "out_rank": 2
            },
            1
          ],
          [
            "aten.to.device",
            {
              "copy": false,
              "dtype": "torch.bool",
              "memory_format": null,
              "non_blocking": false,
              "out_dtype": "bool",
              "out_rank": 2
            },
            1
          ],
          [
            "aten.to.dtype_layout",
            {
              "copy": false,
              "dtype": "torch.bool",
              "memory_format": null,
              "non_blocking": false,
              "out_dtype": "bool",
              "out_rank": 4
            },
            2
          ],
          [
            "aten.transpose.int",
            {
              "dim0": 1,
              "dim1": 2,
              "out_dtype": "f16",
              "out_rank": 4
            },
            8
          ],
          [
            "aten.transpose.int",
            {
              "dim0": 2,
              "dim1": 3,
              "out_dtype": "f16",
              "out_rank": 4
            },
            2
          ],
          [
            "aten.unsqueeze.default",
            {
              "dim": 0,
              "out_dtype": "i64",
              "out_rank": 2
            },
            3
          ],
          [
            "aten.unsqueeze.default",
            {
              "dim": 1,
              "out_dtype": "i64",
              "out_rank": 2
            },
            1
          ],
          [
            "aten.unsqueeze.default",
            {
              "dim": 1,
              "out_dtype": "i64",
              "out_rank": 3
            },
            2
          ],
          [
            "aten.unsqueeze.default",
            {
              "dim": 2,
              "out_dtype": "i64",
              "out_rank": 3
            },
            2
          ],
          [
            "aten.unsqueeze.default",
            {
              "dim": 2,
              "out_dtype": "i64",
              "out_rank": 4
            },
            1
          ],
          [
            "aten.unsqueeze.default",
            {
              "dim": 3,
              "out_dtype": "i64",
              "out_rank": 4
            },
            3
          ],
          [
            "aten.view.default",
            {
              "out_dtype": "f16",
              "out_rank": 4,
              "size": "[*4]"
            },
            6
          ],
          [
            "aten.where.ScalarOther",
            {
              "other": -65504.0,
              "out_dtype": "f16",
              "out_rank": 4
            },
            1
          ]
        ],
        "core-cpu": [
          [
            "aten._softmax.default",
            {
              "dim": -1,
              "half_to_float": false,
              "out_dtype": "f16",
              "out_rank": 4
            },
            2
          ],
          [
            "aten._to_copy.default",
            {
              "dtype": "torch.bool",
              "memory_format": null,
              "non_blocking": false,
              "out_dtype": "bool",
              "out_rank": 2
            },
            1
          ],
          [
            "aten.add.Tensor",
            {
              "alpha": 1,
              "out_dtype": "f16",
              "out_rank": 3
            },
            6
          ],
          [
            "aten.add.Tensor",
            {
              "alpha": 1,
              "out_dtype": "f16",
              "out_rank": 4
            },
            2
          ],
          [
            "aten.add.Tensor",
            {
              "alpha": 1,
              "out_dtype": "i64",
              "out_rank": 1
            },
            2
          ],
          [
            "aten.addmm.default",
            {
              "alpha": 1,
              "beta": 1,
              "out_dtype": "f16",
              "out_rank": 2
            },
            13
          ],
          [
            "aten.arange.start_step",
            {